2==========================================================================

MariaDB [latihan1]> select*from mahasiswa;
+----------+---------------+--------------+----------+----------+---------------+-------+---------------+------------+
| NIM      | NAMA          | ALAMAT_JALAN | KOTA     | KODE_POS | JENIS_KELAMIN | no_hp | TANGGAL_LAHIR | KODE_DOSEN |
+----------+---------------+--------------+----------+----------+---------------+-------+---------------+------------+
| 11223344 | Ari Santoso   |              | Bekasi   |          | Laki-laki     |       | 1998-10-12    |            |
| 11223345 | Ario Talib    |              | Cikarang |          | Laki-laki     |       | 1999-11-16    |            |
| 11223346 | Dina Marlina  |              | Karawang |          | Perempuan     |       | 1997-12-01    |            |
| 11223347 | Lisa Ayu      |              | Bekasi   |          | Perempuan     |       | 1996-01-02    |            |
| 11223348 | Tiara Wahidah |              | Bekasi   |          | Perempuan     |       | 1980-02-05    |            |
| 11223349 | Anton Sinaga  |              | Cikarang |          | Laki-laki     |       | 1988-03-10    |            |
+----------+---------------+--------------+----------+----------+---------------+-------+---------------+------------+
6 rows in set (0.00 sec)

3============================================================================
MariaDB [latihan1]> update mahasiswa set TANGGAL_LAHIR='1979-08-12' WHERE NIM='11223344'
    -> ;
Query OK, 1 row affected (0.09 sec)
Rows matched: 1  Changed: 1  Warnings: 0

MariaDB [latihan1]> select*from mahasiswa;
+----------+---------------+--------------+----------+----------+---------------+-------+---------------+------------+
| NIM      | NAMA          | ALAMAT_JALAN | KOTA     | KODE_POS | JENIS_KELAMIN | no_hp | TANGGAL_LAHIR | KODE_DOSEN |
+----------+---------------+--------------+----------+----------+---------------+-------+---------------+------------+
| 11223344 | Ari Santoso   |              | Bekasi   |          | Laki-laki     |       | 1979-08-12    |            |
| 11223345 | Ario Talib    |              | Cikarang |          | Laki-laki     |       | 1999-11-16    |            |
| 11223346 | Dina Marlina  |              | Karawang |          | Perempuan     |       | 1997-12-01    |            |
| 11223347 | Lisa Ayu      |              | Bekasi   |          | Perempuan     |       | 1996-01-02    |            |
| 11223348 | Tiara Wahidah |              | Bekasi   |          | Perempuan     |       | 1980-02-05    |            |
| 11223349 | Anton Sinaga  |              | Cikarang |          | Laki-laki     |       | 1988-03-10    |            |
+----------+---------------+--------------+----------+----------+---------------+-------+---------------+------------+
6 rows in set (0.00 sec)

4===============================================================================

MariaDB [latihan1]> SELECT*FROM MAHASISWA WHERE NIM='11223344'
    -> ;
+----------+-------------+--------------+--------+----------+---------------+-------+---------------+------------+
| NIM      | NAMA        | ALAMAT_JALAN | KOTA   | KODE_POS | JENIS_KELAMIN | no_hp | TANGGAL_LAHIR | KODE_DOSEN |
+----------+-------------+--------------+--------+----------+---------------+-------+---------------+------------+
| 11223344 | Ari Santoso |              | Bekasi |          | Laki-laki     |       | 1979-08-12    |            |
+----------+-------------+--------------+--------+----------+---------------+-------+---------------+------------+
1 row in set (0.00 sec)

5================================================================================

MariaDB [latihan1]> DELETE FROM MAHASISWA WHERE NIM='11223346'
    -> ;
Query OK, 1 row affected (0.09 sec)

MariaDB [latihan1]> select*from mahasiswa;
+----------+---------------+--------------+----------+----------+---------------+-------+---------------+------------+
| NIM      | NAMA          | ALAMAT_JALAN | KOTA     | KODE_POS | JENIS_KELAMIN | no_hp | TANGGAL_LAHIR | KODE_DOSEN |
+----------+---------------+--------------+----------+----------+---------------+-------+---------------+------------+
| 11223344 | Ari Santoso   |              | Bekasi   |          | Laki-laki     |       | 1979-08-12    |            |
| 11223345 | Ario Talib    |              | Cikarang |          | Laki-laki     |       | 1999-11-16    |            |
| 11223347 | Lisa Ayu      |              | Bekasi   |          | Perempuan     |       | 1996-01-02    |            |
| 11223348 | Tiara Wahidah |              | Bekasi   |          | Perempuan     |       | 1980-02-05    |            |
| 11223349 | Anton Sinaga  |              | Cikarang |          | Laki-laki     |       | 1988-03-10    |            |
+----------+---------------+--------------+----------+----------+---------------+-------+---------------+------------+
5 rows in set (0.00 sec)

6================================================================================

MariaDB [latihan1]> select*from mahasiswa WHERE TANGGAL_LAHIR >='1996-01-02';
+----------+------------+--------------+----------+----------+---------------+-------+---------------+------------+
| NIM      | NAMA       | ALAMAT_JALAN | KOTA     | KODE_POS | JENIS_KELAMIN | no_hp | TANGGAL_LAHIR | KODE_DOSEN |
+----------+------------+--------------+----------+----------+---------------+-------+---------------+------------+
| 11223345 | Ario Talib |              | Cikarang |          | Laki-laki     |       | 1999-11-16    |            |
| 11223347 | Lisa Ayu   |              | Bekasi   |          | Perempuan     |       | 1996-01-02    |            |
+----------+------------+--------------+----------+----------+---------------+-------+---------------+------------+
2 rows in set (0.00 sec)

7================================================================================

MariaDB [latihan1]> select*from mahasiswa WHERE KOTA='BEKASI' AND JENIS_KELAMIN='PEREMPUAN';
+----------+---------------+--------------+--------+----------+---------------+-------+---------------+------------+
| NIM      | NAMA          | ALAMAT_JALAN | KOTA   | KODE_POS | JENIS_KELAMIN | no_hp | TANGGAL_LAHIR | KODE_DOSEN |
+----------+---------------+--------------+--------+----------+---------------+-------+---------------+------------+
| 11223347 | Lisa Ayu      |              | Bekasi |          | Perempuan     |       | 1996-01-02    |            |
| 11223348 | Tiara Wahidah |              | Bekasi |          | Perempuan     |       | 1980-02-05    |            |
+----------+---------------+--------------+--------+----------+---------------+-------+---------------+------------+
2 rows in set (0.00 sec)

8================================================================================

MariaDB [latihan1]> select*from mahasiswa WHERE KOTA='BEKASI' AND JENIS_KELAMIN='LAKI-LAKI' OR TANGGAL_LAHIR NOT BETWEEN '1996-01-01' AND '2019-01-01' AND JENIS_KELAMIN='PEREMPUAN';
+----------+---------------+--------------+--------+----------+---------------+-------+---------------+------------+
| NIM      | NAMA          | ALAMAT_JALAN | KOTA   | KODE_POS | JENIS_KELAMIN | no_hp | TANGGAL_LAHIR | KODE_DOSEN |
+----------+---------------+--------------+--------+----------+---------------+-------+---------------+------------+
| 11223344 | Ari Santoso   |              | Bekasi |          | Laki-laki     |       | 1979-08-12    |            |
| 11223348 | Tiara Wahidah |              | Bekasi |          | Perempuan     |       | 1980-02-05    |            |
+----------+---------------+--------------+--------+----------+---------------+-------+---------------+------------+
2 rows in set (0.00 sec)

9=================================================================================

MariaDB [latihan1]> SELECT NAMA, ALAMAT_JALAN FROM MAHASISWA;
+---------------+--------------+
| NAMA          | ALAMAT_JALAN |
+---------------+--------------+
| Ari Santoso   |              |
| Ario Talib    |              |
| Lisa Ayu      |              |
| Tiara Wahidah |              |
| Anton Sinaga  |              |
+---------------+--------------+
5 rows in set (0.00 sec)

10================================================================================

MariaDB [latihan1]> SELECT*FROM MAHASISWA ORDER BY NAMA ASC;
+----------+---------------+--------------+----------+----------+---------------+-------+---------------+------------+
| NIM      | NAMA          | ALAMAT_JALAN | KOTA     | KODE_POS | JENIS_KELAMIN | no_hp | TANGGAL_LAHIR | KODE_DOSEN |
+----------+---------------+--------------+----------+----------+---------------+-------+---------------+------------+
| 11223349 | Anton Sinaga  |              | Cikarang |          | Laki-laki     |       | 1988-03-10    |            |
| 11223344 | Ari Santoso   |              | Bekasi   |          | Laki-laki     |       | 1979-08-12    |            |
| 11223345 | Ario Talib    |              | Cikarang |          | Laki-laki     |       | 1999-11-16    |            |
| 11223347 | Lisa Ayu      |              | Bekasi   |          | Perempuan     |       | 1996-01-02    |            |
| 11223348 | Tiara Wahidah |              | Bekasi   |          | Perempuan     |       | 1980-02-05    |            |
+----------+---------------+--------------+----------+----------+---------------+-------+---------------+------------+
5 rows in set (0.06 sec)


2. BETWEEN :Operator BETWEEN digunakan untuk mencari apakah nilai suatu atribut dalam rentang nilai tertentu. 
	>=    <= jika ini untuk perbandingan tidak bisa untuk jangkauan

kesimpulan 



